{
  "schema": "CoordinatorDecompositionReceiptV1",
  "schemaVersion": 1,
  "cardID": "V23-P00-C10",
  "authority": {
    "attemptID": 1,
    "executionMode": "PRE_S10_6_PROVISIONAL_ORDERED_IMPLEMENTATION",
    "baseHead": "50c18e716575313097d1e6981ef3d444eac01ad4",
    "baseTree": "307d5dfc0cc95f691185ad8366e3fb7e8dc448bf",
    "candidateBinding": "EXTERNAL_EXACT_HEAD_AND_TREE_RECEIPT_REQUIRED",
    "packageDigest": "99a2719885ad1abfb8cf5d49c6b2099754bb0ba4b5d27fcbae06476aad507570",
    "dossierDigest": "ac176edb8c0857be5c4b0db315c6237e849ecbac09f9bba254af757ab59dcb68",
    "canonicalRegisterDigest": "edd6109aab118cc35c91495b789f70eb0b7c4d5f3d0780ad7a1918e5379e4cbd",
    "directGraphDigest": "4e9feb8b0cb65deddd3a5802efb380911a3439e44f1a0dc56656eadb29aac2ae",
    "selectorManifestDigest": "6ef4089521319677f3d69ed691d638dcc12521789c575c7939966e47670ce7f2",
    "relationManifestDigest": "9b5c7f664af7d79d219e3ca55a28352bc0da7d9ddf998033b9a82187b428fac4",
    "dependencyDispositionDigest": "f30d779c19e94d57d9b3114c09ac07538588676606c78d2e369683ee91169b8c",
    "ownerOverrideReceiptDigest": "e928e8f8415d8a35bbedbdf33a14c20c7f85f2d02600e762465eed8b48bae452",
    "frozenS10ReservationDigest": "274b8e3d9eff11805f5abfec7e1b8a702b91751056f0952e432388c35fe6657a",
    "bootstrapContextDigest": "bc54f8887a6006669a74085c0ab88186dbf41266d5c4ece97727f48ad7ae7ee5",
    "bootstrapPathFenceDigest": "f34d2e3ea8defd5ff7146a499b88e39c76b0a925c519bb524120a2542064d1cb",
    "provisionalPrerequisiteDigest": "38c99ab22e9ee8193fb44e8ae9b66e1dc54ce9d7d54f348243c7d5ac41b824e8",
    "writerAuthority": {
      "ownerID": "A00_BOOTSTRAP_CONTROLLER",
      "writerGeneration": 0
    },
    "ledgerDigest": "3b628688db05bf9ba75673faed3bee8e71d4d82b9ac758b72f0d334025a37225",
    "ledgerCASSequence": 27,
    "phase10PollingDuringParallelExecution": false,
    "acceptanceEnabled": false,
    "hostedDispatchEnabled": false,
    "adoptionEnabled": false,
    "requiresAcceptedS10_6Reconciliation": true,
    "releaseCredit": false
  },
  "coordinatorPath": "FieldEvidenceApp/Features/CheckRunner/CheckRunnerCoordinator.swift",
  "contractPath": "FieldEvidenceApp/Features/CheckRunner/CheckRunnerContracts.swift",
  "extractedSymbols": [
    "CheckRunnerPreparation",
    "BeginDraftSubmission",
    "CheckRunnerCoordinatorError",
    "CheckOutcomeSelection",
    "ReviewEvidence",
    "FinalizationReview",
    "FinalizationIdentifiers",
    "FinalizationResult",
    "CapturePreparation",
    "CaptureCandidate",
    "CheckRunnerCoordinatorFailurePoint"
  ],
  "baseCoordinatorLineCount": 1771,
  "currentCoordinatorLineCount": 1617,
  "contractLineCount": 155,
  "behaviorBodyParity": "EXACT_FROM_FAILURE_INJECTION_MARKER_THROUGH_EOF",
  "nativeGoldenParity": "NOT_RUN_HOSTED_DISPATCH_DISABLED",
  "structuralExtractionSatisfied": true,
  "acceptanceCredit": false,
  "releaseCredit": false,
  "artifactDigest": "5f0da4430c46e2b9f539feb4f0edd477b69b8d0a7be1157a028bee0f53421e20"
}
